IP / TCP 17.110.227.99:https > 10.210.31.23:61471 PA / Raw
IP / TCP 10.210.31.23:61471 > 17.110.227.99:https A
IP / TCP 10.210.31.23:61680 > 190.221.162.59:https A / Padding
IP / TCP 190.221.162.59:https > 10.210.31.23:61680 A
IP / UDP 10.210.31.23:mdns > 224.0.0.251:mdns / Raw
IPv6 / UDP fe80::2ef0:eeff:fe1e:1476:mdns > ff02::fb:mdns / Raw
IP / TCP 10.210.31.23:61480 > 64.233.190.188:https A / Padding
IP / TCP 64.233.190.188:https > 10.210.31.23:61480 A
IP / UDP 10.210.31.23:mdns > 224.0.0.251:mdns / Raw
IPv6 / UDP fe80::2ef0:eeff:fe1e:1476:mdns > ff02::fb:mdns / Raw
IP / TCP 10.210.31.23:61480 > 64.233.190.188:https PA / Raw
IP / TCP 64.233.190.188:https > 10.210.31.23:61480 A
IP / TCP 64.233.190.188:https > 10.210.31.23:61480 PA / Raw
IP / TCP 10.210.31.23:61480 > 64.233.190.188:https A
IP / TCP 10.210.31.23:61681 > 190.221.162.49:https A / Padding
IP / TCP 190.221.162.49:https > 10.210.31.23:61681 A
IP / TCP 190.221.162.59:https > 10.210.31.23:61680 PA / Raw
IP / TCP 190.221.162.59:https > 10.210.31.23:61680 FA
IP / TCP 10.210.31.23:61680 > 190.221.162.59:https A
IP / TCP 10.210.31.23:61680 > 190.221.162.59:https A
IP / TCP 190.221.162.59:https > 10.210.31.23:61680 FA
IP / TCP 10.210.31.23:61680 > 190.221.162.59:https A
IP / TCP 10.210.31.23:61680 > 190.221.162.59:https FA
IP / TCP 190.221.162.59:https > 10.210.31.23:61680 A
ARP who has 10.210.31.23 says 10.210.210.199 / Padding
ARP is at 2c:f0:ee:1e:14:76 says 10.210.31.23 / Padding
IP / UDP 10.210.31.23:57621 > 10.210.255.255:57621 / Raw
IP / UDP 157.92.37.105:30217 > 255.255.255.255:5246 / Raw
IP / TCP 10.210.31.23:61440 > 193.235.203.21:https PA / Raw
IP / TCP 193.235.203.21:https > 10.210.31.23:61440 PA / Raw
IP / TCP 10.210.31.23:61440 > 193.235.203.21:https A
IP / UDP 10.210.31.23:57621 > 10.210.255.255:57621 / Raw
ARP who has 10.210.210.199 says 10.210.31.23 / Padding
ARP is at 00:0c:29:f3:3b:e5 says 10.210.210.199 / Padding
IP / TCP 10.210.31.23:61480 > 64.233.190.188:https A / Padding
IP / TCP 64.233.190.188:https > 10.210.31.23:61480 A
IP / TCP 10.210.31.23:61681 > 190.221.162.49:https A / Padding
IP / TCP 190.221.162.49:https > 10.210.31.23:61681 A
ARP who has 10.210.31.23 says 10.210.210.199 / Padding
ARP is at 2c:f0:ee:1e:14:76 says 10.210.31.23 / Padding
IP / UDP 10.210.31.23:57621 > 10.210.255.255:57621 / Raw
IP / UDP 10.210.31.23:55947 > 224.0.0.251:mdns / Raw
IP / TCP 193.235.203.21:https > 10.210.31.23:61440 PA / Raw
IP / TCP 10.210.31.23:61440 > 193.235.203.21:https A
IP / UDP 10.210.31.23:63741 > 239.255.255.250:1900 / Raw
IP / UDP 10.210.31.23:63741 > 239.255.255.250:1900 / Raw
IP / UDP 10.210.31.23:63741 > 239.255.255.250:1900 / Raw
IP / UDP 10.210.31.23:63741 > 239.255.255.250:1900 / Raw
ARP who has 10.210.210.199 says 10.210.31.23 / Padding
ARP is at 00:0c:29:f3:3b:e5 says 10.210.210.199 / Padding
IP / TCP 10.210.31.23:61480 > 64.233.190.188:https A / Padding
IP / TCP 64.233.190.188:https > 10.210.31.23:61480 A
IP / TCP 10.210.31.23:61681 > 190.221.162.49:https A / Padding
IP / TCP 190.221.162.49:https > 10.210.31.23:61681 A
IP / UDP / DNS Qry "docs.google.com." 
IP / UDP / DNS Ans "190.221.162.49" 
IP / TCP 10.210.31.23:61682 > 190.221.162.49:https S
IP / TCP 190.221.162.49:https > 10.210.31.23:61682 SA
IP / TCP 10.210.31.23:61682 > 190.221.162.49:https A
IP / TCP 10.210.31.23:61682 > 190.221.162.49:https PA / Raw
IP / TCP 190.221.162.49:https > 10.210.31.23:61682 A
IP / TCP 190.221.162.49:https > 10.210.31.23:61682 PA / Raw
IP / TCP 10.210.31.23:61682 > 190.221.162.49:https A
IP / TCP 10.210.31.23:61682 > 190.221.162.49:https PA / Raw
IP / TCP 10.210.31.23:61682 > 190.221.162.49:https PA / Raw
IP / UDP 10.210.31.23:59243 > 239.255.255.250:1900 / Raw
IP / TCP 190.221.162.49:https > 10.210.31.23:61682 PA / Raw
IP / TCP 190.221.162.49:https > 10.210.31.23:61682 A
IP / TCP 10.210.31.23:61682 > 190.221.162.49:https A
IP / TCP 10.210.31.23:61682 > 190.221.162.49:https PA / Raw
IP / TCP 10.210.31.23:61682 > 190.221.162.49:https PA / Raw
IP / TCP 10.210.31.23:61682 > 190.221.162.49:https PA / Raw
IP / TCP 10.210.31.23:61682 > 190.221.162.49:https PA / Raw
IP / TCP 10.210.31.23:61682 > 190.221.162.49:https PA / Raw
IP / TCP 10.210.31.23:61682 > 190.221.162.49:https PA / Raw
IP / TCP 190.221.162.49:https > 10.210.31.23:61682 A
IP / TCP 190.221.162.49:https > 10.210.31.23:61682 A
IP / TCP 190.221.162.49:https > 10.210.31.23:61682 A
IP / TCP 190.221.162.49:https > 10.210.31.23:61682 A
IP / TCP 190.221.162.49:https > 10.210.31.23:61682 A
IP / TCP 190.221.162.49:https > 10.210.31.23:61682 A
IP / TCP 190.221.162.49:https > 10.210.31.23:61682 PA / Raw
IP / TCP 10.210.31.23:61682 > 190.221.162.49:https A
IP / UDP 10.210.31.23:57621 > 10.210.255.255:57621 / Raw
IP / TCP 190.221.162.49:https > 10.210.31.23:61682 PA / Raw
IP / TCP 10.210.31.23:61682 > 190.221.162.49:https A
IP / TCP 10.210.31.23:61682 > 190.221.162.49:https PA / Raw
IP / TCP 10.210.31.23:61682 > 190.221.162.49:https PA / Raw
IP / TCP 190.221.162.49:https > 10.210.31.23:61682 A
IP / TCP 190.221.162.49:https > 10.210.31.23:61682 A
IP / TCP 10.210.31.23:61682 > 190.221.162.49:https PA / Raw
IP / TCP 10.210.31.23:61682 > 190.221.162.49:https PA / Raw
IP / TCP 190.221.162.49:https > 10.210.31.23:61682 A
IP / TCP 190.221.162.49:https > 10.210.31.23:61682 A
IP / TCP 190.221.162.49:https > 10.210.31.23:61682 PA / Raw
IP / TCP 10.210.31.23:61682 > 190.221.162.49:https A
IP / TCP 190.221.162.49:https > 10.210.31.23:61682 PA / Raw
IP / TCP 10.210.31.23:61682 > 190.221.162.49:https A
IP / TCP 190.221.162.49:https > 10.210.31.23:61682 PA / Raw
IP / TCP 10.210.31.23:61682 > 190.221.162.49:https A
IP / TCP 10.210.31.23:61682 > 190.221.162.49:https PA / Raw
IP / TCP 190.221.162.49:https > 10.210.31.23:61682 PA / Raw
IP / TCP 10.210.31.23:61682 > 190.221.162.49:https A
IP / TCP 10.210.31.23:61682 > 190.221.162.49:https PA / Raw
IP / TCP 10.210.31.23:61682 > 190.221.162.49:https PA / Raw
IP / TCP 190.221.162.49:https > 10.210.31.23:61682 A
IP / TCP 190.221.162.49:https > 10.210.31.23:61682 A
IP / TCP 190.221.162.49:https > 10.210.31.23:61682 A
IP / TCP 190.221.162.49:https > 10.210.31.23:61682 PA / Raw
IP / TCP 10.210.31.23:61682 > 190.221.162.49:https A
IP / TCP 10.210.31.23:61682 > 190.221.162.49:https PA / Raw
IP / TCP 10.210.31.23:61682 > 190.221.162.49:https PA / Raw
IP / TCP 10.210.31.23:61682 > 190.221.162.49:https PA / Raw
IP / TCP 190.221.162.49:https > 10.210.31.23:61682 A
IP / TCP 190.221.162.49:https > 10.210.31.23:61682 A
IP / TCP 190.221.162.49:https > 10.210.31.23:61682 A
ARP who has 10.210.31.23 says 10.210.210.199 / Padding
ARP is at 2c:f0:ee:1e:14:76 says 10.210.31.23 / Padding
IP / TCP 190.221.162.49:https > 10.210.31.23:61682 A / Raw
IP / TCP 190.221.162.49:https > 10.210.31.23:61682 PA / Raw
IP / TCP 10.210.31.23:61682 > 190.221.162.49:https A
IP / TCP 190.221.162.49:https > 10.210.31.23:61682 PA / Raw
IP / TCP 10.210.31.23:61682 > 190.221.162.49:https A
IP / TCP 10.210.31.23:61682 > 190.221.162.49:https PA / Raw
IP / TCP 190.221.162.49:https > 10.210.31.23:61682 A
IP / UDP 10.210.31.23:57621 > 10.210.255.255:57621 / Raw
IP / UDP 157.92.37.105:30217 > 255.255.255.255:5246 / Raw
ARP who has 10.210.210.199 says 10.210.31.23 / Padding
ARP is at 00:0c:29:f3:3b:e5 says 10.210.210.199 / Padding
IP / TCP 10.210.31.23:61480 > 64.233.190.188:https A / Padding
IP / TCP 64.233.190.188:https > 10.210.31.23:61480 A
IP / TCP 10.210.31.23:61440 > 193.235.203.21:https PA / Raw
IP / TCP 193.235.203.21:https > 10.210.31.23:61440 PA / Raw
IP / TCP 10.210.31.23:61440 > 193.235.203.21:https A
IP / TCP 10.210.31.23:61682 > 190.221.162.49:https A / Padding
IP / TCP 190.221.162.49:https > 10.210.31.23:61682 A
ARP who has 10.210.31.23 says 10.210.210.199 / Padding
ARP is at 2c:f0:ee:1e:14:76 says 10.210.31.23 / Padding
IP / TCP 10.210.31.23:61677 > 64.233.190.109:imaps PA / Raw
IP / TCP 10.210.31.23:61438 > 64.233.186.109:imaps PA / Raw
IP / TCP 10.210.31.23:61438 > 64.233.186.109:imaps PA / Raw
IP / TCP 10.210.31.23:61677 > 64.233.190.109:imaps PA / Raw
IP / TCP 64.233.190.109:imaps > 10.210.31.23:61677 A
IP / TCP 64.233.186.109:imaps > 10.210.31.23:61438 A
IP / TCP 64.233.186.109:imaps > 10.210.31.23:61438 A
IP / TCP 64.233.190.109:imaps > 10.210.31.23:61677 A
IP / TCP 64.233.190.109:imaps > 10.210.31.23:61677 PA / Raw
IP / TCP 10.210.31.23:61677 > 64.233.190.109:imaps A
IP / TCP 10.210.31.23:61677 > 64.233.190.109:imaps PA / Raw
IP / TCP 64.233.186.109:imaps > 10.210.31.23:61438 PA / Raw
IP / TCP 10.210.31.23:61438 > 64.233.186.109:imaps A
IP / TCP 10.210.31.23:61438 > 64.233.186.109:imaps PA / Raw
IP / TCP 64.233.190.109:imaps > 10.210.31.23:61677 A
IP / TCP 64.233.186.109:imaps > 10.210.31.23:61438 A
IP / TCP 64.233.190.109:imaps > 10.210.31.23:61677 PA / Raw
IP / TCP 10.210.31.23:61677 > 64.233.190.109:imaps A
IP / TCP 64.233.186.109:imaps > 10.210.31.23:61438 PA / Raw
IP / TCP 10.210.31.23:61438 > 64.233.186.109:imaps A
IP / TCP 10.210.31.23:61677 > 64.233.190.109:imaps PA / Raw
IP / TCP 10.210.31.23:61438 > 64.233.186.109:imaps PA / Raw
IP / TCP 64.233.190.109:imaps > 10.210.31.23:61677 A
IP / TCP 64.233.186.109:imaps > 10.210.31.23:61438 A
IP / TCP 64.233.186.109:imaps > 10.210.31.23:61438 PA / Raw
IP / TCP 10.210.31.23:61438 > 64.233.186.109:imaps A
IP / TCP 64.233.190.109:imaps > 10.210.31.23:61677 PA / Raw
IP / TCP 64.233.190.109:imaps > 10.210.31.23:61677 PA / Raw
IP / TCP 64.233.190.109:imaps > 10.210.31.23:61677 PA / Raw
IP / TCP 10.210.31.23:61677 > 64.233.190.109:imaps A
IP / TCP 10.210.31.23:61677 > 64.233.190.109:imaps A
IP / TCP 10.210.31.23:61677 > 64.233.190.109:imaps A
IP / TCP 10.210.31.23:61677 > 64.233.190.109:imaps PA / Raw
IP / TCP 10.210.31.23:61438 > 64.233.186.109:imaps PA / Raw
IP / TCP 64.233.190.109:imaps > 10.210.31.23:61677 A
IP / TCP 64.233.186.109:imaps > 10.210.31.23:61438 A
IP / TCP 10.210.31.23:61682 > 190.221.162.49:https PA / Raw
IP / TCP 10.210.31.23:61682 > 190.221.162.49:https PA / Raw
IP / TCP 190.221.162.49:https > 10.210.31.23:61682 A
IP / TCP 190.221.162.49:https > 10.210.31.23:61682 A
IP / TCP 190.221.162.49:https > 10.210.31.23:61682 PA / Raw
IP / TCP 10.210.31.23:61682 > 190.221.162.49:https A
IP / TCP 64.233.186.109:imaps > 10.210.31.23:61438 PA / Raw
IP / TCP 10.210.31.23:61438 > 64.233.186.109:imaps A
IP / TCP 10.210.31.23:61438 > 64.233.186.109:imaps PA / Raw
IP / TCP 64.233.186.109:imaps > 10.210.31.23:61438 A
IP / TCP 190.221.162.49:https > 10.210.31.23:61682 PA / Raw
IP / TCP 190.221.162.49:https > 10.210.31.23:61682 PA / Raw
IP / TCP 10.210.31.23:61682 > 190.221.162.49:https A
IP / TCP 10.210.31.23:61682 > 190.221.162.49:https A
IP / TCP 190.221.162.49:https > 10.210.31.23:61682 PA / Raw
IP / TCP 10.210.31.23:61682 > 190.221.162.49:https A
IP / TCP 190.221.162.49:https > 10.210.31.23:61682 PA / Raw
IP / TCP 10.210.31.23:61682 > 190.221.162.49:https A
IP / TCP 190.221.162.49:https > 10.210.31.23:61682 PA / Raw
IP / TCP 10.210.31.23:61682 > 190.221.162.49:https A
IP / TCP 10.210.31.23:61682 > 190.221.162.49:https A
IP / TCP 190.221.162.49:https > 10.210.31.23:61682 PA / Raw
IP / TCP 190.221.162.49:https > 10.210.31.23:61682 PA / Raw
IP / TCP 10.210.31.23:61682 > 190.221.162.49:https A
IP / TCP 10.210.31.23:61682 > 190.221.162.49:https A
IP / TCP 190.221.162.49:https > 10.210.31.23:61682 PA / Raw
IP / TCP 190.221.162.49:https > 10.210.31.23:61682 PA / Raw
IP / TCP 10.210.31.23:61682 > 190.221.162.49:https A
IP / TCP 10.210.31.23:61682 > 190.221.162.49:https A
IP / TCP 10.210.31.23:61682 > 190.221.162.49:https A
IP / TCP 190.221.162.49:https > 10.210.31.23:61682 PA / Raw
IP / TCP 10.210.31.23:61682 > 190.221.162.49:https A
IP / TCP 190.221.162.49:https > 10.210.31.23:61682 PA / Raw
IP / TCP 190.221.162.49:https > 10.210.31.23:61682 PA / Raw
IP / TCP 190.221.162.49:https > 10.210.31.23:61682 PA / Raw
IP / TCP 10.210.31.23:61682 > 190.221.162.49:https A
IP / TCP 10.210.31.23:61682 > 190.221.162.49:https A
IP / TCP 10.210.31.23:61682 > 190.221.162.49:https A
IP / TCP 10.210.31.23:61682 > 190.221.162.49:https A
IP / TCP 190.221.162.49:https > 10.210.31.23:61682 PA / Raw
IP / TCP 190.221.162.49:https > 10.210.31.23:61682 PA / Raw
IP / TCP 10.210.31.23:61682 > 190.221.162.49:https A
IP / TCP 10.210.31.23:61682 > 190.221.162.49:https A
IP / TCP 190.221.162.49:https > 10.210.31.23:61682 PA / Raw
IP / TCP 190.221.162.49:https > 10.210.31.23:61682 PA / Raw
IP / TCP 10.210.31.23:61682 > 190.221.162.49:https A
IP / TCP 10.210.31.23:61682 > 190.221.162.49:https A
IP / TCP 190.221.162.49:https > 10.210.31.23:61682 PA / Raw
IP / TCP 10.210.31.23:61682 > 190.221.162.49:https A
IP / TCP 10.210.31.23:61682 > 190.221.162.49:https A
IP / TCP 190.221.162.49:https > 10.210.31.23:61682 PA / Raw
IP / TCP 190.221.162.49:https > 10.210.31.23:61682 PA / Raw
IP / TCP 10.210.31.23:61682 > 190.221.162.49:https A
IP / TCP 10.210.31.23:61682 > 190.221.162.49:https A
IP / TCP 190.221.162.49:https > 10.210.31.23:61682 PA / Raw
IP / TCP 10.210.31.23:61682 > 190.221.162.49:https A
IP / TCP 10.210.31.23:61682 > 190.221.162.49:https A
IP / TCP 190.221.162.49:https > 10.210.31.23:61682 PA / Raw
IP / TCP 190.221.162.49:https > 10.210.31.23:61682 PA / Raw
IP / TCP 10.210.31.23:61682 > 190.221.162.49:https A
IP / TCP 10.210.31.23:61682 > 190.221.162.49:https A
IP / TCP 190.221.162.49:https > 10.210.31.23:61682 PA / Raw
IP / TCP 10.210.31.23:61682 > 190.221.162.49:https A
IP / TCP 190.221.162.49:https > 10.210.31.23:61682 PA / Raw
IP / TCP 10.210.31.23:61682 > 190.221.162.49:https A
IP / TCP 10.210.31.23:61682 > 190.221.162.49:https A
IP / TCP 190.221.162.49:https > 10.210.31.23:61682 A / Raw
IP / TCP 190.221.162.49:https > 10.210.31.23:61682 PA / Raw
IP / TCP 10.210.31.23:61682 > 190.221.162.49:https A
IP / TCP 190.221.162.49:https > 10.210.31.23:61682 PA / Raw
IP / TCP 190.221.162.49:https > 10.210.31.23:61682 PA / Raw
IP / TCP 10.210.31.23:61682 > 190.221.162.49:https A
IP / TCP 10.210.31.23:61682 > 190.221.162.49:https A
IP / TCP 10.210.31.23:61682 > 190.221.162.49:https A
IP / TCP 190.221.162.49:https > 10.210.31.23:61682 PA / Raw
IP / TCP 10.210.31.23:61682 > 190.221.162.49:https A
IP / TCP 190.221.162.49:https > 10.210.31.23:61682 PA / Raw
IP / TCP 10.210.31.23:61682 > 190.221.162.49:https A
IP / TCP 10.210.31.23:61682 > 190.221.162.49:https A
IP / TCP 190.221.162.49:https > 10.210.31.23:61682 A / Raw
IP / TCP 190.221.162.49:https > 10.210.31.23:61682 PA / Raw
IP / TCP 10.210.31.23:61682 > 190.221.162.49:https A
IP / TCP 190.221.162.49:https > 10.210.31.23:61682 PA / Raw
IP / TCP 10.210.31.23:61682 > 190.221.162.49:https A
IP / TCP 190.221.162.49:https > 10.210.31.23:61682 PA / Raw
IP / TCP 10.210.31.23:61682 > 190.221.162.49:https A
IP / TCP 190.221.162.49:https > 10.210.31.23:61682 PA / Raw
IP / TCP 10.210.31.23:61682 > 190.221.162.49:https A
IP / TCP 190.221.162.49:https > 10.210.31.23:61682 PA / Raw
IP / TCP 190.221.162.49:https > 10.210.31.23:61682 PA / Raw
IP / TCP 10.210.31.23:61682 > 190.221.162.49:https A
IP / TCP 10.210.31.23:61682 > 190.221.162.49:https A
IP / TCP 190.221.162.49:https > 10.210.31.23:61682 A / Raw
IP / TCP 10.210.31.23:61682 > 190.221.162.49:https A
IP / TCP 190.221.162.49:https > 10.210.31.23:61682 PA / Raw
IP / TCP 190.221.162.49:https > 10.210.31.23:61682 PA / Raw
IP / TCP 190.221.162.49:https > 10.210.31.23:61682 PA / Raw
IP / TCP 190.221.162.49:https > 10.210.31.23:61682 PA / Raw
IP / TCP 10.210.31.23:61682 > 190.221.162.49:https A
IP / TCP 10.210.31.23:61682 > 190.221.162.49:https A
IP / TCP 10.210.31.23:61682 > 190.221.162.49:https A
IP / TCP 10.210.31.23:61682 > 190.221.162.49:https A
IP / TCP 10.210.31.23:61682 > 190.221.162.49:https A
IP / TCP 10.210.31.23:61682 > 190.221.162.49:https PA / Raw
IP / TCP 190.221.162.49:https > 10.210.31.23:61682 A
IP / TCP 64.233.190.109:imaps > 10.210.31.23:61677 PA / Raw
IP / TCP 10.210.31.23:61677 > 64.233.190.109:imaps A
IP / TCP 10.210.31.23:61677 > 64.233.190.109:imaps PA / Raw
IP / TCP 64.233.190.109:imaps > 10.210.31.23:61677 A
IP / TCP 64.233.186.109:imaps > 10.210.31.23:61438 PA / Raw
IP / TCP 10.210.31.23:61438 > 64.233.186.109:imaps A
IP / TCP 10.210.31.23:61438 > 64.233.186.109:imaps PA / Raw
IP / TCP 10.210.31.23:61438 > 64.233.186.109:imaps A / Raw
IP / TCP 10.210.31.23:61438 > 64.233.186.109:imaps PA / Raw
IP / TCP 64.233.186.109:imaps > 10.210.31.23:61438 A
IP / TCP 64.233.186.109:imaps > 10.210.31.23:61438 A
IP / TCP 64.233.186.109:imaps > 10.210.31.23:61438 A
IP / TCP 10.210.31.23:61438 > 64.233.186.109:imaps PA / Raw
IP / TCP 64.233.186.109:imaps > 10.210.31.23:61438 A
IP / TCP 64.233.190.109:imaps > 10.210.31.23:61677 PA / Raw
IP / TCP 10.210.31.23:61677 > 64.233.190.109:imaps A
IP / TCP 64.233.186.109:imaps > 10.210.31.23:61438 PA / Raw
IP / TCP 10.210.31.23:61438 > 64.233.186.109:imaps A
IP / TCP 64.233.186.109:imaps > 10.210.31.23:61438 PA / Raw
IP / TCP 10.210.31.23:61438 > 64.233.186.109:imaps A
IP / TCP 64.233.186.109:imaps > 10.210.31.23:61438 PA / Raw
IP / TCP 10.210.31.23:61438 > 64.233.186.109:imaps A
IP / TCP 64.233.186.109:imaps > 10.210.31.23:61438 PA / Raw
IP / TCP 64.233.186.109:imaps > 10.210.31.23:61438 PA / Raw
IP / TCP 10.210.31.23:61438 > 64.233.186.109:imaps A
IP / TCP 10.210.31.23:61438 > 64.233.186.109:imaps A
IP / TCP 64.233.186.109:imaps > 10.210.31.23:61438 PA / Raw
IP / TCP 10.210.31.23:61438 > 64.233.186.109:imaps A
IP / TCP 64.233.186.109:imaps > 10.210.31.23:61438 PA / Raw
IP / TCP 10.210.31.23:61438 > 64.233.186.109:imaps A
IP / TCP 64.233.186.109:imaps > 10.210.31.23:61438 PA / Raw
IP / TCP 10.210.31.23:61438 > 64.233.186.109:imaps A
IP / TCP 64.233.186.109:imaps > 10.210.31.23:61438 PA / Raw
IP / TCP 10.210.31.23:61438 > 64.233.186.109:imaps A
IP / TCP 64.233.186.109:imaps > 10.210.31.23:61438 PA / Raw
IP / TCP 10.210.31.23:61438 > 64.233.186.109:imaps A
IP / TCP 64.233.186.109:imaps > 10.210.31.23:61438 PA / Raw
IP / TCP 10.210.31.23:61438 > 64.233.186.109:imaps A
IP / TCP 64.233.186.109:imaps > 10.210.31.23:61438 PA / Raw
IP / TCP 10.210.31.23:61438 > 64.233.186.109:imaps A
IP / TCP 64.233.186.109:imaps > 10.210.31.23:61438 PA / Raw
IP / TCP 10.210.31.23:61438 > 64.233.186.109:imaps A
IP / TCP 64.233.186.109:imaps > 10.210.31.23:61438 PA / Raw
IP / TCP 10.210.31.23:61438 > 64.233.186.109:imaps A
IP / TCP 64.233.186.109:imaps > 10.210.31.23:61438 PA / Raw
IP / TCP 10.210.31.23:61438 > 64.233.186.109:imaps A
IP / TCP 64.233.186.109:imaps > 10.210.31.23:61438 PA / Raw
IP / TCP 10.210.31.23:61438 > 64.233.186.109:imaps A
IP / TCP 64.233.186.109:imaps > 10.210.31.23:61438 PA / Raw
IP / TCP 10.210.31.23:61438 > 64.233.186.109:imaps A
IP / TCP 64.233.186.109:imaps > 10.210.31.23:61438 PA / Raw
IP / TCP 10.210.31.23:61438 > 64.233.186.109:imaps A
IP / TCP 64.233.186.109:imaps > 10.210.31.23:61438 PA / Raw
IP / TCP 64.233.186.109:imaps > 10.210.31.23:61438 PA / Raw
IP / TCP 64.233.186.109:imaps > 10.210.31.23:61438 PA / Raw
IP / TCP 64.233.186.109:imaps > 10.210.31.23:61438 PA / Raw
IP / TCP 64.233.186.109:imaps > 10.210.31.23:61438 PA / Raw
IP / TCP 10.210.31.23:61438 > 64.233.186.109:imaps A
IP / TCP 10.210.31.23:61438 > 64.233.186.109:imaps A
IP / TCP 10.210.31.23:61438 > 64.233.186.109:imaps A
IP / TCP 10.210.31.23:61438 > 64.233.186.109:imaps A
IP / TCP 10.210.31.23:61438 > 64.233.186.109:imaps A
IP / TCP 10.210.31.23:61677 > 64.233.190.109:imaps PA / Raw
IP / TCP 10.210.31.23:61438 > 64.233.186.109:imaps PA / Raw
IP / TCP 64.233.190.109:imaps > 10.210.31.23:61677 A
IP / TCP 64.233.186.109:imaps > 10.210.31.23:61438 A
IP / TCP 64.233.186.109:imaps > 10.210.31.23:61438 PA / Raw
IP / TCP 64.233.190.109:imaps > 10.210.31.23:61677 PA / Raw
IP / TCP 10.210.31.23:61438 > 64.233.186.109:imaps A
IP / TCP 10.210.31.23:61677 > 64.233.190.109:imaps A
IP / TCP 64.233.190.109:imaps > 10.210.31.23:61677 PA / Raw
IP / TCP 10.210.31.23:61677 > 64.233.190.109:imaps A
IP / TCP 10.210.31.23:61677 > 64.233.190.109:imaps PA / Raw
IP / TCP 64.233.190.109:imaps > 10.210.31.23:61677 A
IP / TCP 64.233.190.109:imaps > 10.210.31.23:61677 PA / Raw
IP / TCP 10.210.31.23:61677 > 64.233.190.109:imaps A
IP / TCP 64.233.190.109:imaps > 10.210.31.23:61677 PA / Raw
IP / TCP 64.233.190.109:imaps > 10.210.31.23:61677 PA / Raw
IP / TCP 10.210.31.23:61677 > 64.233.190.109:imaps A
IP / TCP 10.210.31.23:61677 > 64.233.190.109:imaps A
IP / TCP 10.210.31.23:61677 > 64.233.190.109:imaps PA / Raw
IP / TCP 10.210.31.23:61677 > 64.233.190.109:imaps PA / Raw
IP / TCP 64.233.190.109:imaps > 10.210.31.23:61677 A
IP / TCP 64.233.190.109:imaps > 10.210.31.23:61677 A
IP / TCP 64.233.190.109:imaps > 10.210.31.23:61677 PA / Raw
IP / TCP 64.233.190.109:imaps > 10.210.31.23:61677 PA / Raw
IP / TCP 64.233.190.109:imaps > 10.210.31.23:61677 PA / Raw
IP / TCP 10.210.31.23:61677 > 64.233.190.109:imaps A
IP / TCP 10.210.31.23:61677 > 64.233.190.109:imaps A
IP / TCP 10.210.31.23:61677 > 64.233.190.109:imaps A
IP / TCP 10.210.31.23:61677 > 64.233.190.109:imaps PA / Raw
IP / TCP 64.233.190.109:imaps > 10.210.31.23:61677 A
IP / TCP 64.233.190.109:imaps > 10.210.31.23:61677 PA / Raw
IP / TCP 10.210.31.23:61677 > 64.233.190.109:imaps A
IP / TCP 10.210.31.23:61677 > 64.233.190.109:imaps PA / Raw
IP / TCP 64.233.190.109:imaps > 10.210.31.23:61677 A
IP / TCP 64.233.190.109:imaps > 10.210.31.23:61677 PA / Raw
IP / TCP 64.233.190.109:imaps > 10.210.31.23:61677 PA / Raw
IP / TCP 10.210.31.23:61677 > 64.233.190.109:imaps A
IP / TCP 10.210.31.23:61677 > 64.233.190.109:imaps A
IP / TCP 10.210.31.23:61677 > 64.233.190.109:imaps PA / Raw
IP / TCP 64.233.190.109:imaps > 10.210.31.23:61677 A
IP / TCP 64.233.190.109:imaps > 10.210.31.23:61677 PA / Raw
IP / TCP 10.210.31.23:61677 > 64.233.190.109:imaps A
IP / TCP 10.210.31.23:61677 > 64.233.190.109:imaps PA / Raw
IP / TCP 64.233.190.109:imaps > 10.210.31.23:61677 A
IP / TCP 64.233.190.109:imaps > 10.210.31.23:61677 PA / Raw
IP / TCP 10.210.31.23:61677 > 64.233.190.109:imaps A
IP / TCP 64.233.190.109:imaps > 10.210.31.23:61677 PA / Raw
IP / TCP 10.210.31.23:61677 > 64.233.190.109:imaps A
IP / TCP 10.210.31.23:61677 > 64.233.190.109:imaps PA / Raw
IP / TCP 64.233.190.109:imaps > 10.210.31.23:61677 A
IP / TCP 64.233.190.109:imaps > 10.210.31.23:61677 PA / Raw
IP / TCP 10.210.31.23:61677 > 64.233.190.109:imaps A
IP / TCP 64.233.190.109:imaps > 10.210.31.23:61677 PA / Raw
IP / TCP 10.210.31.23:61677 > 64.233.190.109:imaps A
IP / TCP 64.233.190.109:imaps > 10.210.31.23:61677 PA / Raw
IP / TCP 10.210.31.23:61677 > 64.233.190.109:imaps A
IP / TCP 64.233.190.109:imaps > 10.210.31.23:61677 PA / Raw
IP / TCP 64.233.190.109:imaps > 10.210.31.23:61677 PA / Raw
IP / TCP 64.233.190.109:imaps > 10.210.31.23:61677 PA / Raw
IP / TCP 10.210.31.23:61677 > 64.233.190.109:imaps A
IP / TCP 10.210.31.23:61677 > 64.233.190.109:imaps A
IP / TCP 10.210.31.23:61677 > 64.233.190.109:imaps A
IP / TCP 10.210.31.23:61677 > 64.233.190.109:imaps A
IP / TCP 64.233.190.109:imaps > 10.210.31.23:61677 PA / Raw
IP / TCP 64.233.190.109:imaps > 10.210.31.23:61677 PA / Raw
IP / TCP 10.210.31.23:61677 > 64.233.190.109:imaps A
IP / TCP 10.210.31.23:61677 > 64.233.190.109:imaps A
IP / TCP 10.210.31.23:61677 > 64.233.190.109:imaps PA / Raw
IP / TCP 64.233.190.109:imaps > 10.210.31.23:61677 A
IP / TCP 64.233.190.109:imaps > 10.210.31.23:61677 PA / Raw
IP / TCP 64.233.190.109:imaps > 10.210.31.23:61677 PA / Raw
IP / TCP 64.233.190.109:imaps > 10.210.31.23:61677 PA / Raw
IP / TCP 10.210.31.23:61677 > 64.233.190.109:imaps A
IP / TCP 10.210.31.23:61677 > 64.233.190.109:imaps A
IP / TCP 10.210.31.23:61677 > 64.233.190.109:imaps A
IP / TCP 64.233.190.109:imaps > 10.210.31.23:61677 PA / Raw
IP / TCP 64.233.190.109:imaps > 10.210.31.23:61677 PA / Raw
IP / TCP 64.233.190.109:imaps > 10.210.31.23:61677 PA / Raw
IP / TCP 64.233.190.109:imaps > 10.210.31.23:61677 PA / Raw
IP / TCP 10.210.31.23:61677 > 64.233.190.109:imaps A
IP / TCP 10.210.31.23:61677 > 64.233.190.109:imaps A
IP / TCP 10.210.31.23:61677 > 64.233.190.109:imaps A
IP / TCP 10.210.31.23:61677 > 64.233.190.109:imaps A
IP / TCP 64.233.190.109:imaps > 10.210.31.23:61677 PA / Raw
IP / TCP 10.210.31.23:61677 > 64.233.190.109:imaps A
IP / TCP 10.210.31.23:61677 > 64.233.190.109:imaps A
IP / TCP 10.210.31.23:61677 > 64.233.190.109:imaps PA / Raw
IP / TCP 64.233.190.109:imaps > 10.210.31.23:61677 A
IP / TCP 64.233.190.109:imaps > 10.210.31.23:61677 PA / Raw
IP / TCP 10.210.31.23:61677 > 64.233.190.109:imaps A
IP / TCP 10.210.31.23:61677 > 64.233.190.109:imaps PA / Raw
IP / TCP 10.210.31.23:61677 > 64.233.190.109:imaps FA
IP / TCP 64.233.190.109:imaps > 10.210.31.23:61677 A
IP / TCP 10.210.31.23:61677 > 64.233.190.109:imaps FA
IP / TCP 64.233.190.109:imaps > 10.210.31.23:61677 A
IP / TCP 10.210.31.23:61677 > 64.233.190.109:imaps A
IP / TCP 64.233.190.109:imaps > 10.210.31.23:61677 PA / Raw
IP / TCP 64.233.190.109:imaps > 10.210.31.23:61677 FA
IP / TCP 10.210.31.23:61677 > 64.233.190.109:imaps R / Padding
IP / TCP 10.210.31.23:61677 > 64.233.190.109:imaps R / Padding
IP / UDP 10.210.31.23:57621 > 10.210.255.255:57621 / Raw
IP / UDP 10.210.31.23:netbios_ns > 10.210.255.255:netbios_ns / NBNSQueryRequest / Raw
IP / TCP 10.210.31.23:61480 > 64.233.190.188:https A / Padding
IP / TCP 64.233.190.188:https > 10.210.31.23:61480 A
IP / UDP 10.210.31.23:55947 > 224.0.0.251:mdns / Raw
IP / TCP 193.235.203.21:https > 10.210.31.23:61440 PA / Raw
IP / TCP 10.210.31.23:61440 > 193.235.203.21:https A
IP / UDP 10.210.31.23:61268 > 239.255.255.250:1900 / Raw
IP / UDP 10.210.31.23:61268 > 239.255.255.250:1900 / Raw
IP / UDP 10.210.31.23:61268 > 239.255.255.250:1900 / Raw
IP / UDP 10.210.31.23:61268 > 239.255.255.250:1900 / Raw
IP / TCP 10.210.31.23:61440 > 193.235.203.21:https PA / Raw
IP / TCP 190.221.162.49:https > 10.210.31.23:61681 PA / Raw
IP / TCP 190.221.162.49:https > 10.210.31.23:61681 FA
IP / TCP 190.221.162.49:https > 10.210.31.23:61681 FA
IP / TCP 10.210.31.23:61681 > 190.221.162.49:https A
IP / TCP 10.210.31.23:61681 > 190.221.162.49:https A
IP / TCP 10.210.31.23:61681 > 190.221.162.49:https A
IP / TCP 10.210.31.23:61681 > 190.221.162.49:https FA
IP / TCP 190.221.162.49:https > 10.210.31.23:61681 A
IP / TCP 193.235.203.21:https > 10.210.31.23:61440 PA / Raw
IP / TCP 10.210.31.23:61440 > 193.235.203.21:https A
IP / UDP 10.210.31.23:57621 > 10.210.255.255:57621 / Raw
ARP who has 10.210.31.23 says 10.210.210.199 / Padding
ARP is at 2c:f0:ee:1e:14:76 says 10.210.31.23 / Padding
IP / TCP 10.210.31.23:61682 > 190.221.162.49:https A / Padding
IP / TCP 190.221.162.49:https > 10.210.31.23:61682 A
IP / UDP 10.210.31.23:59243 > 239.255.255.250:1900 / Raw
IP / UDP 10.210.31.23:57621 > 10.210.255.255:57621 / Raw
ARP who has 10.210.210.199 says 10.210.31.23 / Padding
ARP is at 00:0c:29:f3:3b:e5 says 10.210.210.199 / Padding
IP / TCP 10.210.31.23:61480 > 64.233.190.188:https A / Padding
IP / TCP 64.233.190.188:https > 10.210.31.23:61480 A
IP / UDP 157.92.37.105:30217 > 255.255.255.255:5246 / Raw
ARP who has 10.210.210.199 says 10.210.31.23 / Padding
ARP is at 00:0c:29:f3:3b:e5 says 10.210.210.199 / Padding
IP / TCP 10.210.31.23:61682 > 190.221.162.49:https A / Padding
IP / TCP 190.221.162.49:https > 10.210.31.23:61682 A
ARP who has 10.210.31.23 says 10.210.210.199 / Padding
ARP is at 2c:f0:ee:1e:14:76 says 10.210.31.23 / Padding
IP / TCP 10.210.31.23:61440 > 193.235.203.21:https PA / Raw
IP / TCP 193.235.203.21:https > 10.210.31.23:61440 PA / Raw
IP / TCP 10.210.31.23:61440 > 193.235.203.21:https A
IP / UDP 10.210.31.23:57621 > 10.210.255.255:57621 / Raw
IP / TCP 10.210.31.23:61480 > 64.233.190.188:https A / Padding
IP / TCP 64.233.190.188:https > 10.210.31.23:61480 A
IP / UDP 10.210.31.23:57621 > 10.210.255.255:57621 / Raw
ARP who has 10.210.210.199 says 10.210.31.23 / Padding
ARP is at 00:0c:29:f3:3b:e5 says 10.210.210.199 / Padding
IP / TCP 10.210.31.23:61682 > 190.221.162.49:https A / Padding
IP / TCP 190.221.162.49:https > 10.210.31.23:61682 A
IP / UDP 10.210.31.23:55947 > 224.0.0.251:mdns / Raw
IP / TCP 193.235.203.21:https > 10.210.31.23:61440 PA / Raw
IP / TCP 10.210.31.23:61440 > 193.235.203.21:https A
IP / UDP 10.210.31.23:57427 > 239.255.255.250:1900 / Raw
IP / UDP 10.210.31.23:57427 > 239.255.255.250:1900 / Raw
IP / UDP 10.210.31.23:57427 > 239.255.255.250:1900 / Raw
IP / UDP 10.210.31.23:57427 > 239.255.255.250:1900 / Raw
ARP who has 10.210.31.23 says 10.210.210.199 / Padding
ARP is at 2c:f0:ee:1e:14:76 says 10.210.31.23 / Padding
IP / UDP 10.210.31.23:57621 > 10.210.255.255:57621 / Raw
IP / TCP 10.210.31.23:61480 > 64.233.190.188:https A / Padding
IP / TCP 64.233.190.188:https > 10.210.31.23:61480 A
IP / UDP / DNS Qry "b._dns-sd._udp.fcen.uba.ar." 
IP / UDP / DNS Qry "db._dns-sd._udp.fcen.uba.ar." 
IP / UDP / DNS Qry "lb._dns-sd._udp.fcen.uba.ar." 
IP / UDP / DNS Ans 
IP / UDP / DNS Ans 
IP / UDP / DNS Ans 
IP / TCP 10.210.31.23:61682 > 190.221.162.49:https A / Padding
IP / TCP 190.221.162.49:https > 10.210.31.23:61682 A
IP / UDP / DNS Qry "ssl.gstatic.com." 
IP / UDP / DNS Ans "190.221.162.34" 
IP / TCP 10.210.31.23:61683 > 190.221.162.34:https S
IP / TCP 190.221.162.34:https > 10.210.31.23:61683 SA
IP / TCP 10.210.31.23:61683 > 190.221.162.34:https A
IP / TCP 10.210.31.23:61683 > 190.221.162.34:https PA / Raw
IP / TCP 190.221.162.34:https > 10.210.31.23:61683 A
IP / TCP 190.221.162.34:https > 10.210.31.23:61683 PA / Raw
IP / TCP 10.210.31.23:61683 > 190.221.162.34:https A
IP / TCP 10.210.31.23:61683 > 190.221.162.34:https PA / Raw
IP / TCP 190.221.162.34:https > 10.210.31.23:61683 PA / Raw
IP / TCP 10.210.31.23:61683 > 190.221.162.34:https A
IP / TCP 10.210.31.23:61683 > 190.221.162.34:https PA / Raw
IP / TCP 10.210.31.23:61683 > 190.221.162.34:https PA / Raw
IP / TCP 10.210.31.23:61683 > 190.221.162.34:https PA / Raw
IP / TCP 10.210.31.23:61683 > 190.221.162.34:https PA / Raw
IP / TCP 10.210.31.23:61683 > 190.221.162.34:https PA / Raw
IP / TCP 190.221.162.34:https > 10.210.31.23:61683 A
IP / TCP 190.221.162.34:https > 10.210.31.23:61683 PA / Raw
IP / TCP 190.221.162.34:https > 10.210.31.23:61683 A
IP / TCP 10.210.31.23:61683 > 190.221.162.34:https A
IP / TCP 190.221.162.34:https > 10.210.31.23:61683 PA / Raw
IP / TCP 10.210.31.23:61683 > 190.221.162.34:https A
IP / TCP 190.221.162.34:https > 10.210.31.23:61683 PA / Raw
IP / TCP 10.210.31.23:61683 > 190.221.162.34:https A
IP / TCP 10.210.31.23:61683 > 190.221.162.34:https PA / Raw
IP / TCP 190.221.162.34:https > 10.210.31.23:61683 A
IP / UDP 10.210.31.23:59243 > 239.255.255.250:1900 / Raw
IP / UDP 10.210.31.23:57621 > 10.210.255.255:57621 / Raw
ARP who has 10.210.210.199 says 10.210.31.23 / Padding
ARP is at 00:0c:29:f3:3b:e5 says 10.210.210.199 / Padding
IP / TCP 10.210.31.23:61480 > 64.233.190.188:https A / Padding
IP / TCP 64.233.190.188:https > 10.210.31.23:61480 A
IP / UDP 157.92.37.105:30217 > 255.255.255.255:5246 / Raw
ARP who has 10.210.31.23 says 10.210.210.199 / Padding
ARP is at 2c:f0:ee:1e:14:76 says 10.210.31.23 / Padding
IP / TCP 10.210.31.23:61440 > 193.235.203.21:https PA / Raw
IP / TCP 193.235.203.21:https > 10.210.31.23:61440 PA / Raw
IP / TCP 10.210.31.23:61440 > 193.235.203.21:https A
IP / TCP 10.210.31.23:61682 > 190.221.162.49:https A / Padding
IP / TCP 190.221.162.49:https > 10.210.31.23:61682 A
IP / TCP 10.210.31.23:61683 > 190.221.162.34:https A / Padding
IP / TCP 190.221.162.34:https > 10.210.31.23:61683 A
IP / UDP 10.210.31.23:57621 > 10.210.255.255:57621 / Raw
IP / TCP 190.221.162.49:https > 10.210.31.23:61682 PA / Raw
IP / TCP 190.221.162.49:https > 10.210.31.23:61682 FA
IP / TCP 190.221.162.49:https > 10.210.31.23:61682 FA
IP / TCP 10.210.31.23:61682 > 190.221.162.49:https A
IP / TCP 10.210.31.23:61682 > 190.221.162.49:https A
IP / TCP 10.210.31.23:61682 > 190.221.162.49:https A
IP / TCP 10.210.31.23:61682 > 190.221.162.49:https FA
IP / TCP 190.221.162.49:https > 10.210.31.23:61682 A
IP / TCP 10.210.31.23:61480 > 64.233.190.188:https A / Padding
IP / TCP 64.233.190.188:https > 10.210.31.23:61480 A
IP / UDP 10.210.31.23:57621 > 10.210.255.255:57621 / Raw
IP / TCP 193.235.203.21:https > 10.210.31.23:61440 PA / Raw
IP / TCP 10.210.31.23:61440 > 193.235.203.21:https A
IP / UDP 10.210.31.23:55947 > 224.0.0.251:mdns / Raw
IP / TCP 10.210.31.23:61683 > 190.221.162.34:https A / Padding
IP / UDP 10.210.31.23:49338 > 239.255.255.250:1900 / Raw
IP / TCP 190.221.162.34:https > 10.210.31.23:61683 A
IP / UDP 10.210.31.23:49338 > 239.255.255.250:1900 / Raw
IP / UDP 10.210.31.23:49338 > 239.255.255.250:1900 / Raw
IP / UDP 10.210.31.23:49338 > 239.255.255.250:1900 / Raw
ARP who has 10.210.31.23 says 10.210.210.199 / Padding
ARP is at 2c:f0:ee:1e:14:76 says 10.210.31.23 / Padding
ARP who has 10.210.210.199 says 10.210.31.23 / Padding
ARP is at 00:0c:29:f3:3b:e5 says 10.210.210.199 / Padding
IP / TCP 10.210.31.23:61480 > 64.233.190.188:https A / Padding
IP / TCP 64.233.190.188:https > 10.210.31.23:61480 A
IP / TCP 10.210.31.23:61438 > 64.233.186.109:imaps PA / Raw
IP / UDP / DNS Qry "imap.gmail.com." 
IP / UDP / DNS Ans "gmail-imap.l.google.com." 
IP / TCP 10.210.31.23:61684 > 64.233.186.109:imaps S
IP / UDP 10.210.31.23:57621 > 10.210.255.255:57621 / Raw
IP / TCP 64.233.186.109:imaps > 10.210.31.23:61438 A
IP / TCP 64.233.186.109:imaps > 10.210.31.23:61684 SA
IP / TCP 10.210.31.23:61684 > 64.233.186.109:imaps A
IP / TCP 10.210.31.23:61684 > 64.233.186.109:imaps PA / Raw
IP / TCP 64.233.186.109:imaps > 10.210.31.23:61684 A
IP / TCP 10.210.31.23:61684 > 64.233.186.109:imaps A
IP / TCP 64.233.186.109:imaps > 10.210.31.23:61684 A / Raw
IP / TCP 64.233.186.109:imaps > 10.210.31.23:61684 PA / Raw
IP / TCP 10.210.31.23:61684 > 64.233.186.109:imaps A
IP / TCP 10.210.31.23:61684 > 64.233.186.109:imaps PA / Raw
IP / TCP 64.233.186.109:imaps > 10.210.31.23:61684 A
IP / TCP 10.210.31.23:61684 > 64.233.186.109:imaps PA / Raw
IP / TCP 64.233.186.109:imaps > 10.210.31.23:61684 A
IP / TCP 64.233.186.109:imaps > 10.210.31.23:61684 PA / Raw
IP / TCP 10.210.31.23:61684 > 64.233.186.109:imaps A
IP / TCP 64.233.186.109:imaps > 10.210.31.23:61684 PA / Raw
IP / TCP 64.233.186.109:imaps > 10.210.31.23:61438 PA / Raw
IP / TCP 10.210.31.23:61684 > 64.233.186.109:imaps A
IP / TCP 10.210.31.23:61438 > 64.233.186.109:imaps A
IP / TCP 10.210.31.23:61684 > 64.233.186.109:imaps PA / Raw
IP / TCP 10.210.31.23:61438 > 64.233.186.109:imaps PA / Raw
IP / TCP 64.233.186.109:imaps > 10.210.31.23:61438 A
IP / TCP 64.233.186.109:imaps > 10.210.31.23:61684 A
IP / TCP 64.233.186.109:imaps > 10.210.31.23:61684 PA / Raw
IP / TCP 10.210.31.23:61684 > 64.233.186.109:imaps A
IP / TCP 10.210.31.23:61684 > 64.233.186.109:imaps PA / Raw
IP / TCP 64.233.186.109:imaps > 10.210.31.23:61684 A
IP / TCP 64.233.186.109:imaps > 10.210.31.23:61438 PA / Raw
IP / TCP 10.210.31.23:61438 > 64.233.186.109:imaps A
IP / TCP 10.210.31.23:61438 > 64.233.186.109:imaps PA / Raw
IP / TCP 64.233.186.109:imaps > 10.210.31.23:61684 PA / Raw
IP / TCP 10.210.31.23:61684 > 64.233.186.109:imaps A
IP / TCP 10.210.31.23:61684 > 64.233.186.109:imaps PA / Raw
IP / TCP 64.233.186.109:imaps > 10.210.31.23:61438 A
IP / TCP 64.233.186.109:imaps > 10.210.31.23:61684 A
IP / TCP 64.233.186.109:imaps > 10.210.31.23:61438 PA / Raw
IP / TCP 10.210.31.23:61438 > 64.233.186.109:imaps A
IP / TCP 64.233.186.109:imaps > 10.210.31.23:61438 PA / Raw
IP / TCP 64.233.186.109:imaps > 10.210.31.23:61438 PA / Raw
IP / TCP 10.210.31.23:61438 > 64.233.186.109:imaps A
IP / TCP 10.210.31.23:61438 > 64.233.186.109:imaps A
IP / TCP 10.210.31.23:61438 > 64.233.186.109:imaps PA / Raw
IP / TCP 64.233.186.109:imaps > 10.210.31.23:61438 A
IP / TCP 64.233.186.109:imaps > 10.210.31.23:61684 PA / Raw
IP / TCP 10.210.31.23:61684 > 64.233.186.109:imaps A
IP / TCP 10.210.31.23:61684 > 64.233.186.109:imaps PA / Raw
IP / TCP 64.233.186.109:imaps > 10.210.31.23:61684 A
IP / TCP 64.233.186.109:imaps > 10.210.31.23:61438 PA / Raw
IP / TCP 10.210.31.23:61438 > 64.233.186.109:imaps A
IP / TCP 64.233.186.109:imaps > 10.210.31.23:61684 PA / Raw
IP / TCP 10.210.31.23:61684 > 64.233.186.109:imaps A
IP / TCP 10.210.31.23:61684 > 64.233.186.109:imaps PA / Raw
IP / TCP 64.233.186.109:imaps > 10.210.31.23:61684 A
IP / TCP 64.233.186.109:imaps > 10.210.31.23:61684 PA / Raw
IP / TCP 10.210.31.23:61684 > 64.233.186.109:imaps A
IP / TCP 10.210.31.23:61684 > 64.233.186.109:imaps PA / Raw
IP / TCP 64.233.186.109:imaps > 10.210.31.23:61684 A
IP / TCP 64.233.186.109:imaps > 10.210.31.23:61684 PA / Raw
IP / TCP 10.210.31.23:61684 > 64.233.186.109:imaps A
IP / TCP 10.210.31.23:61684 > 64.233.186.109:imaps PA / Raw
IP / TCP 64.233.186.109:imaps > 10.210.31.23:61684 A
IP / TCP 64.233.186.109:imaps > 10.210.31.23:61684 PA / Raw
IP / TCP 10.210.31.23:61684 > 64.233.186.109:imaps A
IP / TCP 10.210.31.23:61684 > 64.233.186.109:imaps PA / Raw
IP / TCP 10.210.31.23:61684 > 64.233.186.109:imaps A / Raw
IP / TCP 10.210.31.23:61684 > 64.233.186.109:imaps PA / Raw
IP / TCP 64.233.186.109:imaps > 10.210.31.23:61684 A
IP / TCP 64.233.186.109:imaps > 10.210.31.23:61684 A
IP / TCP 64.233.186.109:imaps > 10.210.31.23:61684 A
IP / TCP 10.210.31.23:61684 > 64.233.186.109:imaps PA / Raw
IP / TCP 64.233.186.109:imaps > 10.210.31.23:61684 A
IP / TCP 64.233.186.109:imaps > 10.210.31.23:61684 PA / Raw
IP / TCP 10.210.31.23:61684 > 64.233.186.109:imaps A
IP / TCP 64.233.186.109:imaps > 10.210.31.23:61684 PA / Raw
IP / TCP 64.233.186.109:imaps > 10.210.31.23:61684 PA / Raw
IP / TCP 64.233.186.109:imaps > 10.210.31.23:61684 PA / Raw
IP / TCP 64.233.186.109:imaps > 10.210.31.23:61684 PA / Raw
IP / TCP 64.233.186.109:imaps > 10.210.31.23:61684 PA / Raw
IP / TCP 64.233.186.109:imaps > 10.210.31.23:61684 PA / Raw
IP / TCP 64.233.186.109:imaps > 10.210.31.23:61684 PA / Raw
IP / TCP 64.233.186.109:imaps > 10.210.31.23:61684 PA / Raw
IP / TCP 64.233.186.109:imaps > 10.210.31.23:61684 PA / Raw
IP / TCP 10.210.31.23:61684 > 64.233.186.109:imaps A
IP / TCP 10.210.31.23:61684 > 64.233.186.109:imaps A
IP / TCP 10.210.31.23:61684 > 64.233.186.109:imaps A
IP / TCP 10.210.31.23:61684 > 64.233.186.109:imaps A
IP / TCP 10.210.31.23:61684 > 64.233.186.109:imaps A
IP / TCP 10.210.31.23:61684 > 64.233.186.109:imaps A
IP / TCP 10.210.31.23:61684 > 64.233.186.109:imaps A
IP / TCP 10.210.31.23:61684 > 64.233.186.109:imaps A
IP / TCP 10.210.31.23:61684 > 64.233.186.109:imaps A
IP / TCP 64.233.186.109:imaps > 10.210.31.23:61684 PA / Raw
IP / TCP 10.210.31.23:61684 > 64.233.186.109:imaps A
IP / TCP 64.233.186.109:imaps > 10.210.31.23:61684 PA / Raw
IP / TCP 10.210.31.23:61684 > 64.233.186.109:imaps A
IP / TCP 10.210.31.23:61684 > 64.233.186.109:imaps PA / Raw
IP / TCP 64.233.186.109:imaps > 10.210.31.23:61684 A
IP / TCP 64.233.186.109:imaps > 10.210.31.23:61684 PA / Raw
IP / TCP 10.210.31.23:61684 > 64.233.186.109:imaps A
IP / UDP 10.210.31.23:59243 > 239.255.255.250:1900 / Raw
IP / TCP 10.210.31.23:61683 > 190.221.162.34:https A / Padding
IP / TCP 190.221.162.34:https > 10.210.31.23:61683 A
ARP who has 10.210.31.23 says 10.210.210.199 / Padding
ARP is at 2c:f0:ee:1e:14:76 says 10.210.31.23 / Padding
IP / UDP 157.92.37.105:30217 > 255.255.255.255:5246 / Raw
IP / UDP 10.210.31.23:57621 > 10.210.255.255:57621 / Raw
ARP who has 10.210.210.199 says 10.210.31.23 / Padding
ARP is at 00:0c:29:f3:3b:e5 says 10.210.210.199 / Padding
IP / TCP 10.210.31.23:61440 > 193.235.203.21:https PA / Raw
IP / TCP 193.235.203.21:https > 10.210.31.23:61440 PA / Raw
IP / TCP 10.210.31.23:61440 > 193.235.203.21:https A
IP / TCP 10.210.31.23:61480 > 64.233.190.188:https A / Padding
IP / TCP 64.233.190.188:https > 10.210.31.23:61480 A
ARP who has 10.210.210.199 says 10.210.31.23 / Padding
ARP is at 00:0c:29:f3:3b:e5 says 10.210.210.199 / Padding
IP / TCP 10.210.31.23:61683 > 190.221.162.34:https A / Padding
IP / TCP 190.221.162.34:https > 10.210.31.23:61683 A
IP / UDP 10.210.31.23:57621 > 10.210.255.255:57621 / Raw
ARP who has 10.210.210.199 says 10.210.31.23 / Padding
ARP is at 00:0c:29:f3:3b:e5 says 10.210.210.199 / Padding
IP / TCP 10.210.31.23:61480 > 64.233.190.188:https A / Padding
IP / TCP 64.233.190.188:https > 10.210.31.23:61480 A
IP / TCP 193.235.203.21:https > 10.210.31.23:61440 PA / Raw
IP / TCP 10.210.31.23:61440 > 193.235.203.21:https A
ARP who has 10.210.31.23 says 10.210.210.199 / Padding
ARP is at 2c:f0:ee:1e:14:76 says 10.210.31.23 / Padding
IP / UDP 10.210.31.23:52677 > 239.255.255.250:1900 / Raw
IP / UDP 10.210.31.23:52677 > 239.255.255.250:1900 / Raw
IP / UDP 10.210.31.23:52677 > 239.255.255.250:1900 / Raw
IP / UDP 10.210.31.23:52677 > 239.255.255.250:1900 / Raw
IP / UDP 10.210.31.23:55947 > 224.0.0.251:mdns / Raw
IP / TCP 10.210.31.23:61683 > 190.221.162.34:https A / Padding
IP / TCP 190.221.162.34:https > 10.210.31.23:61683 A
IP / UDP 10.210.31.23:57621 > 10.210.255.255:57621 / Raw
IP / TCP 190.221.162.34:https > 10.210.31.23:61683 PA / Raw
IP / TCP 10.210.31.23:61683 > 190.221.162.34:https A
IP / TCP 10.210.31.23:61683 > 190.221.162.34:https FA
IP / TCP 190.221.162.34:https > 10.210.31.23:61683 FA
IP / TCP 10.210.31.23:61683 > 190.221.162.34:https FA
IP / TCP 190.221.162.34:https > 10.210.31.23:61683 FA
IP / TCP 190.221.162.34:https > 10.210.31.23:61683 A
IP / TCP 10.210.31.23:61683 > 190.221.162.34:https FA
IP / TCP 10.210.31.23:61683 > 190.221.162.34:https A
IP / TCP 190.221.162.34:https > 10.210.31.23:61683 A
ARP who has 10.210.31.23 says 10.210.210.199 / Padding
ARP is at 2c:f0:ee:1e:14:76 says 10.210.31.23 / Padding
IP / TCP 10.210.31.23:61480 > 64.233.190.188:https A / Padding
IP / TCP 64.233.190.188:https > 10.210.31.23:61480 A
IP / UDP 10.210.31.23:59243 > 239.255.255.250:1900 / Raw
IP / UDP 157.92.37.105:30217 > 255.255.255.255:5246 / Raw
IP / UDP 10.210.31.23:57621 > 10.210.255.255:57621 / Raw
ARP who has 10.210.210.199 says 10.210.31.23 / Padding
ARP is at 00:0c:29:f3:3b:e5 says 10.210.210.199 / Padding
IP / TCP 10.210.31.23:61440 > 193.235.203.21:https PA / Raw
IP / TCP 193.235.203.21:https > 10.210.31.23:61440 PA / Raw
IP / TCP 10.210.31.23:61440 > 193.235.203.21:https A
ARP who has 10.210.31.23 says 10.210.210.199 / Padding
ARP is at 2c:f0:ee:1e:14:76 says 10.210.31.23 / Padding
IP / TCP 10.210.31.23:61480 > 64.233.190.188:https A / Padding
IP / TCP 64.233.190.188:https > 10.210.31.23:61480 A
IP / UDP 10.210.31.23:57621 > 10.210.255.255:57621 / Raw
ARP who has 10.210.210.199 says 10.210.31.23 / Padding
ARP is at 00:0c:29:f3:3b:e5 says 10.210.210.199 / Padding
IP / UDP / NTP v4, client
IP / TCP 193.235.203.21:https > 10.210.31.23:61440 PA / Raw
IP / TCP 10.210.31.23:61440 > 193.235.203.21:https A
IP / UDP 10.210.31.23:57316 > 239.255.255.250:1900 / Raw
IP / UDP 10.210.31.23:57316 > 239.255.255.250:1900 / Raw
IP / UDP 10.210.31.23:57316 > 239.255.255.250:1900 / Raw
IP / UDP 10.210.31.23:57316 > 239.255.255.250:1900 / Raw
ARP who has 10.210.31.23 says 10.210.210.199 / Padding
ARP is at 2c:f0:ee:1e:14:76 says 10.210.31.23 / Padding
IP / UDP 10.210.31.23:57621 > 10.210.255.255:57621 / Raw
IP / UDP 10.210.31.23:55947 > 224.0.0.251:mdns / Raw
IP / TCP 10.210.31.23:61440 > 193.235.203.21:https PA / Raw
IP / TCP 10.210.31.23:61480 > 64.233.190.188:https A / Padding
IP / TCP 64.233.190.188:https > 10.210.31.23:61480 A
IP / TCP 193.235.203.21:https > 10.210.31.23:61440 PA / Raw
IP / TCP 10.210.31.23:61440 > 193.235.203.21:https A
IP / UDP 10.210.31.23:57621 > 10.210.255.255:57621 / Raw
IP / UDP 10.210.31.23:59243 > 239.255.255.250:1900 / Raw
IP / TCP 193.235.203.21:https > 10.210.31.23:61440 PA / Raw
IP / TCP 10.210.31.23:61440 > 193.235.203.21:https A
IP / TCP 10.210.31.23:61440 > 193.235.203.21:https PA / Raw
IP / TCP 193.235.203.21:https > 10.210.31.23:61440 A
IP / TCP 193.235.203.21:https > 10.210.31.23:61440 PA / Raw
IP / TCP 10.210.31.23:61440 > 193.235.203.21:https A
ARP who has 10.210.31.23 says 10.210.210.199 / Padding
ARP is at 2c:f0:ee:1e:14:76 says 10.210.31.23 / Padding
IP / TCP 10.210.31.23:61480 > 64.233.190.188:https A / Padding
IP / TCP 64.233.190.188:https > 10.210.31.23:61480 A
IP / UDP 157.92.37.105:30217 > 255.255.255.255:5246 / Raw
IP / TCP 10.210.31.23:61440 > 193.235.203.21:https PA / Raw
IP / TCP 193.235.203.21:https > 10.210.31.23:61440 A
IP / TCP 193.235.203.21:https > 10.210.31.23:61440 PA / Raw
IP / TCP 10.210.31.23:61440 > 193.235.203.21:https A
IP / UDP 10.210.31.23:57621 > 10.210.255.255:57621 / Raw
IP / TCP 10.210.31.23:61684 > 64.233.186.109:imaps PA / Raw
IP / TCP 10.210.31.23:61438 > 64.233.186.109:imaps PA / Raw
IP / TCP 10.210.31.23:61684 > 64.233.186.109:imaps PA / Raw
IP / TCP 64.233.186.109:imaps > 10.210.31.23:61684 A
IP / TCP 10.210.31.23:61438 > 64.233.186.109:imaps PA / Raw
IP / TCP 64.233.186.109:imaps > 10.210.31.23:61438 A
IP / TCP 64.233.186.109:imaps > 10.210.31.23:61684 A
IP / TCP 64.233.186.109:imaps > 10.210.31.23:61438 A
IP / TCP 64.233.186.109:imaps > 10.210.31.23:61684 PA / Raw
IP / TCP 64.233.186.109:imaps > 10.210.31.23:61438 PA / Raw
IP / TCP 10.210.31.23:61684 > 64.233.186.109:imaps A
IP / TCP 10.210.31.23:61438 > 64.233.186.109:imaps A
IP / TCP 10.210.31.23:61684 > 64.233.186.109:imaps PA / Raw
IP / TCP 10.210.31.23:61438 > 64.233.186.109:imaps PA / Raw
IP / TCP 64.233.186.109:imaps > 10.210.31.23:61438 A
IP / TCP 64.233.186.109:imaps > 10.210.31.23:61684 A
IP / TCP 64.233.186.109:imaps > 10.210.31.23:61684 PA / Raw
IP / TCP 64.233.186.109:imaps > 10.210.31.23:61438 PA / Raw
IP / TCP 10.210.31.23:61684 > 64.233.186.109:imaps A
IP / TCP 10.210.31.23:61438 > 64.233.186.109:imaps A
IP / TCP 10.210.31.23:61684 > 64.233.186.109:imaps PA / Raw
IP / TCP 10.210.31.23:61438 > 64.233.186.109:imaps PA / Raw
IP / TCP 64.233.186.109:imaps > 10.210.31.23:61438 A
IP / TCP 64.233.186.109:imaps > 10.210.31.23:61684 A
IP / TCP 64.233.186.109:imaps > 10.210.31.23:61684 PA / Raw
IP / TCP 64.233.186.109:imaps > 10.210.31.23:61684 PA / Raw
IP / TCP 64.233.186.109:imaps > 10.210.31.23:61684 PA / Raw
IP / TCP 64.233.186.109:imaps > 10.210.31.23:61438 PA / Raw
IP / TCP 64.233.186.109:imaps > 10.210.31.23:61438 PA / Raw
IP / TCP 10.210.31.23:61684 > 64.233.186.109:imaps A
IP / TCP 10.210.31.23:61684 > 64.233.186.109:imaps A
IP / TCP 10.210.31.23:61684 > 64.233.186.109:imaps A
IP / TCP 10.210.31.23:61438 > 64.233.186.109:imaps A
IP / TCP 10.210.31.23:61438 > 64.233.186.109:imaps A
IP / TCP 10.210.31.23:61684 > 64.233.186.109:imaps PA / Raw
IP / TCP 10.210.31.23:61438 > 64.233.186.109:imaps PA / Raw
IP / TCP 64.233.186.109:imaps > 10.210.31.23:61684 A
IP / TCP 64.233.186.109:imaps > 10.210.31.23:61438 A
IP / TCP 64.233.186.109:imaps > 10.210.31.23:61684 PA / Raw
IP / TCP 64.233.186.109:imaps > 10.210.31.23:61438 PA / Raw
IP / TCP 10.210.31.23:61684 > 64.233.186.109:imaps A
IP / TCP 10.210.31.23:61438 > 64.233.186.109:imaps A
IP / TCP 10.210.31.23:61684 > 64.233.186.109:imaps PA / Raw
IP / TCP 64.233.186.109:imaps > 10.210.31.23:61438 PA / Raw
IP / TCP 64.233.186.109:imaps > 10.210.31.23:61438 PA / Raw
IP / TCP 10.210.31.23:61438 > 64.233.186.109:imaps A
IP / TCP 10.210.31.23:61438 > 64.233.186.109:imaps A
IP / TCP 10.210.31.23:61438 > 64.233.186.109:imaps PA / Raw
IP / TCP 64.233.186.109:imaps > 10.210.31.23:61438 PA / Raw
IP / TCP 10.210.31.23:61438 > 64.233.186.109:imaps A
IP / TCP 64.233.186.109:imaps > 10.210.31.23:61438 A
IP / TCP 64.233.186.109:imaps > 10.210.31.23:61684 A
IP / TCP 64.233.186.109:imaps > 10.210.31.23:61684 PA / Raw
IP / TCP 10.210.31.23:61684 > 64.233.186.109:imaps A
IP / TCP 10.210.31.23:61684 > 64.233.186.109:imaps PA / Raw
IP / TCP 10.210.31.23:61684 > 64.233.186.109:imaps A / Raw
IP / TCP 10.210.31.23:61684 > 64.233.186.109:imaps PA / Raw
IP / TCP 64.233.186.109:imaps > 10.210.31.23:61438 PA / Raw
IP / TCP 10.210.31.23:61438 > 64.233.186.109:imaps A
IP / TCP 64.233.186.109:imaps > 10.210.31.23:61438 PA / Raw
IP / TCP 10.210.31.23:61438 > 64.233.186.109:imaps A
IP / TCP 64.233.186.109:imaps > 10.210.31.23:61684 A
IP / TCP 10.210.31.23:61438 > 64.233.186.109:imaps PA / Raw
IP / TCP 64.233.186.109:imaps > 10.210.31.23:61684 A
IP / TCP 64.233.186.109:imaps > 10.210.31.23:61684 A
IP / TCP 10.210.31.23:61684 > 64.233.186.109:imaps PA / Raw
IP / TCP 64.233.186.109:imaps > 10.210.31.23:61438 A
IP / TCP 64.233.186.109:imaps > 10.210.31.23:61684 A
IP / TCP 64.233.186.109:imaps > 10.210.31.23:61684 PA / Raw
IP / TCP 64.233.186.109:imaps > 10.210.31.23:61684 PA / Raw
IP / TCP 10.210.31.23:61684 > 64.233.186.109:imaps A
IP / TCP 10.210.31.23:61684 > 64.233.186.109:imaps A
IP / TCP 64.233.186.109:imaps > 10.210.31.23:61684 PA / Raw
IP / TCP 64.233.186.109:imaps > 10.210.31.23:61684 PA / Raw
IP / TCP 10.210.31.23:61684 > 64.233.186.109:imaps A
IP / TCP 10.210.31.23:61684 > 64.233.186.109:imaps A
IP / TCP 64.233.186.109:imaps > 10.210.31.23:61684 PA / Raw
IP / TCP 64.233.186.109:imaps > 10.210.31.23:61684 PA / Raw
IP / TCP 64.233.186.109:imaps > 10.210.31.23:61684 PA / Raw
IP / TCP 64.233.186.109:imaps > 10.210.31.23:61684 PA / Raw
IP / TCP 64.233.186.109:imaps > 10.210.31.23:61684 PA / Raw
IP / TCP 64.233.186.109:imaps > 10.210.31.23:61684 PA / Raw
IP / TCP 64.233.186.109:imaps > 10.210.31.23:61684 PA / Raw
IP / TCP 64.233.186.109:imaps > 10.210.31.23:61684 PA / Raw
IP / TCP 64.233.186.109:imaps > 10.210.31.23:61684 PA / Raw
IP / TCP 64.233.186.109:imaps > 10.210.31.23:61684 PA / Raw
IP / TCP 64.233.186.109:imaps > 10.210.31.23:61684 PA / Raw
IP / TCP 64.233.186.109:imaps > 10.210.31.23:61684 PA / Raw
IP / TCP 10.210.31.23:61684 > 64.233.186.109:imaps A
IP / TCP 10.210.31.23:61684 > 64.233.186.109:imaps A
IP / TCP 10.210.31.23:61684 > 64.233.186.109:imaps A
IP / TCP 10.210.31.23:61684 > 64.233.186.109:imaps A
IP / TCP 10.210.31.23:61684 > 64.233.186.109:imaps A
IP / TCP 10.210.31.23:61684 > 64.233.186.109:imaps A
IP / TCP 10.210.31.23:61684 > 64.233.186.109:imaps A
IP / TCP 10.210.31.23:61684 > 64.233.186.109:imaps A
IP / TCP 10.210.31.23:61684 > 64.233.186.109:imaps A
IP / TCP 10.210.31.23:61684 > 64.233.186.109:imaps A
IP / TCP 10.210.31.23:61684 > 64.233.186.109:imaps A
IP / TCP 10.210.31.23:61684 > 64.233.186.109:imaps A
IP / TCP 64.233.186.109:imaps > 10.210.31.23:61684 PA / Raw
IP / TCP 64.233.186.109:imaps > 10.210.31.23:61684 PA / Raw
IP / TCP 64.233.186.109:imaps > 10.210.31.23:61684 PA / Raw
IP / TCP 64.233.186.109:imaps > 10.210.31.23:61684 PA / Raw
IP / TCP 64.233.186.109:imaps > 10.210.31.23:61684 PA / Raw
IP / TCP 64.233.186.109:imaps > 10.210.31.23:61684 PA / Raw
IP / TCP 10.210.31.23:61684 > 64.233.186.109:imaps A
IP / TCP 10.210.31.23:61684 > 64.233.186.109:imaps A
IP / TCP 10.210.31.23:61684 > 64.233.186.109:imaps A
IP / TCP 10.210.31.23:61684 > 64.233.186.109:imaps A
IP / TCP 10.210.31.23:61684 > 64.233.186.109:imaps A
IP / TCP 10.210.31.23:61684 > 64.233.186.109:imaps A
IP / TCP 64.233.186.109:imaps > 10.210.31.23:61438 PA / Raw
IP / TCP 10.210.31.23:61438 > 64.233.186.109:imaps A
IP / TCP 64.233.186.109:imaps > 10.210.31.23:61438 PA / Raw
IP / TCP 10.210.31.23:61438 > 64.233.186.109:imaps A
IP / TCP 10.210.31.23:61684 > 64.233.186.109:imaps PA / Raw
IP / TCP 64.233.186.109:imaps > 10.210.31.23:61684 A
IP / TCP 64.233.186.109:imaps > 10.210.31.23:61684 PA / Raw
IP / TCP 10.210.31.23:61684 > 64.233.186.109:imaps A
ARP who has 10.210.31.23 says 10.210.210.199 / Padding
ARP is at 2c:f0:ee:1e:14:76 says 10.210.31.23 / Padding
IP / UDP 10.210.31.23:57621 > 10.210.255.255:57621 / Raw
IP / TCP 10.210.31.23:61480 > 64.233.190.188:https A / Padding
IP / TCP 64.233.190.188:https > 10.210.31.23:61480 A
IP / UDP 10.210.31.23:netbios_ns > 10.210.255.255:netbios_ns / NBNSQueryRequest / Raw
IP / TCP 193.235.203.21:https > 10.210.31.23:61440 PA / Raw
IP / TCP 10.210.31.23:61440 > 193.235.203.21:https A
IP / UDP 10.210.31.23:51645 > 239.255.255.250:1900 / Raw
IP / UDP 10.210.31.23:51645 > 239.255.255.250:1900 / Raw
IP / UDP 10.210.31.23:51645 > 239.255.255.250:1900 / Raw
IP / UDP 10.210.31.23:51645 > 239.255.255.250:1900 / Raw
ARP who has 10.210.31.23 says 10.210.210.199 / Padding
ARP is at 2c:f0:ee:1e:14:76 says 10.210.31.23 / Padding
IP / UDP / DNS Qry "ssl.gstatic.com." 
IP / UDP / DNS Ans "190.221.162.20" 
IP / TCP 10.210.31.23:61685 > 190.221.162.20:https S
IP / TCP 190.221.162.20:https > 10.210.31.23:61685 SA
IP / TCP 10.210.31.23:61685 > 190.221.162.20:https A
IP / TCP 10.210.31.23:61685 > 190.221.162.20:https PA / Raw
IP / TCP 190.221.162.20:https > 10.210.31.23:61685 A
IP / TCP 190.221.162.20:https > 10.210.31.23:61685 PA / Raw
IP / TCP 10.210.31.23:61685 > 190.221.162.20:https A
IP / TCP 10.210.31.23:61685 > 190.221.162.20:https PA / Raw
IP / TCP 10.210.31.23:61685 > 190.221.162.20:https PA / Raw
IP / TCP 10.210.31.23:61685 > 190.221.162.20:https PA / Raw
IP / TCP 10.210.31.23:61685 > 190.221.162.20:https PA / Raw
IP / TCP 10.210.31.23:61685 > 190.221.162.20:https PA / Raw
IP / TCP 190.221.162.20:https > 10.210.31.23:61685 A
IP / TCP 190.221.162.20:https > 10.210.31.23:61685 PA / Raw
IP / TCP 190.221.162.20:https > 10.210.31.23:61685 A
IP / TCP 190.221.162.20:https > 10.210.31.23:61685 PA / Raw
IP / TCP 10.210.31.23:61685 > 190.221.162.20:https A
IP / TCP 10.210.31.23:61685 > 190.221.162.20:https A
IP / TCP 10.210.31.23:61685 > 190.221.162.20:https PA / Raw
IP / TCP 190.221.162.20:https > 10.210.31.23:61685 PA / Raw
IP / TCP 190.221.162.20:https > 10.210.31.23:61685 PA / Raw
IP / TCP 10.210.31.23:61685 > 190.221.162.20:https A
IP / TCP 10.210.31.23:61685 > 190.221.162.20:https A
IP / TCP 10.210.31.23:61685 > 190.221.162.20:https PA / Raw
IP / TCP 190.221.162.20:https > 10.210.31.23:61685 A
IP / UDP 10.210.31.23:57621 > 10.210.255.255:57621 / Raw
IP / UDP 10.210.31.23:55947 > 224.0.0.251:mdns / Raw
IP / TCP 10.210.31.23:61480 > 64.233.190.188:https A / Padding
IP / TCP 64.233.190.188:https > 10.210.31.23:61480 A
ARP who has 10.210.31.23 says 10.210.210.199 / Padding
ARP is at 2c:f0:ee:1e:14:76 says 10.210.31.23 / Padding
IP / UDP 10.210.31.23:59243 > 239.255.255.250:1900 / Raw
IP / UDP 10.210.31.23:57621 > 10.210.255.255:57621 / Raw
IP / UDP 157.92.37.105:30217 > 255.255.255.255:5246 / Raw
ARP who has 10.210.210.199 says 10.210.31.23 / Padding
ARP is at 00:0c:29:f3:3b:e5 says 10.210.210.199 / Padding
IP / TCP 10.210.31.23:61685 > 190.221.162.20:https A / Padding
IP / TCP 190.221.162.20:https > 10.210.31.23:61685 A
ARP who has 10.210.31.23 says 10.210.210.199 / Padding
ARP is at 2c:f0:ee:1e:14:76 says 10.210.31.23 / Padding
IP / TCP 193.235.203.21:https > 10.210.31.23:61440 PA / Raw
IP / TCP 10.210.31.23:61440 > 193.235.203.21:https A
IP / TCP 10.210.31.23:61440 > 193.235.203.21:https PA / Raw
IP / TCP 193.235.203.21:https > 10.210.31.23:61440 PA / Raw
IP / TCP 10.210.31.23:61440 > 193.235.203.21:https A
IP / TCP 10.210.31.23:61480 > 64.233.190.188:https A / Padding
IP / TCP 64.233.190.188:https > 10.210.31.23:61480 A
IP / UDP / DNS Qry "clients4.google.com." 
IP / UDP / DNS Ans "clients.l.google.com." 
IP / TCP 10.210.31.23:61686 > 190.221.162.39:https S
IP / TCP 190.221.162.39:https > 10.210.31.23:61686 SA
IP / TCP 10.210.31.23:61686 > 190.221.162.39:https A
IP / TCP 10.210.31.23:61686 > 190.221.162.39:https PA / Raw
IP / TCP 190.221.162.39:https > 10.210.31.23:61686 A
IP / TCP 190.221.162.39:https > 10.210.31.23:61686 PA / Raw
IP / TCP 10.210.31.23:61686 > 190.221.162.39:https A
IP / TCP 10.210.31.23:61686 > 190.221.162.39:https PA / Raw
IP / TCP 10.210.31.23:61686 > 190.221.162.39:https PA / Raw
IP / TCP 10.210.31.23:61686 > 190.221.162.39:https PA / Raw
IP / TCP 10.210.31.23:61686 > 190.221.162.39:https PA / Raw
IP / TCP 10.210.31.23:61686 > 190.221.162.39:https PA / Raw
IP / TCP 190.221.162.39:https > 10.210.31.23:61686 PA / Raw
IP / TCP 10.210.31.23:61686 > 190.221.162.39:https A
IP / TCP 10.210.31.23:61686 > 190.221.162.39:https PA / Raw
IP / TCP 190.221.162.39:https > 10.210.31.23:61686 A
IP / TCP 190.221.162.39:https > 10.210.31.23:61686 PA / Raw
IP / TCP 10.210.31.23:61686 > 190.221.162.39:https A
IP / TCP 190.221.162.39:https > 10.210.31.23:61686 A
IP / TCP 190.221.162.39:https > 10.210.31.23:61686 A
IP / TCP 190.221.162.39:https > 10.210.31.23:61686 PA / Raw
IP / TCP 190.221.162.39:https > 10.210.31.23:61686 PA / Raw
IP / TCP 10.210.31.23:61686 > 190.221.162.39:https A
IP / TCP 10.210.31.23:61686 > 190.221.162.39:https A
IP / TCP 10.210.31.23:61686 > 190.221.162.39:https PA / Raw
IP / TCP 190.221.162.39:https > 10.210.31.23:61686 A
ARP who has 10.210.31.23 says 10.210.210.199 / Padding
ARP is at 2c:f0:ee:1e:14:76 says 10.210.31.23 / Padding
IP / TCP 10.210.31.23:61469 > 17.110.228.28:https PA / Raw
IP / TCP 17.110.228.28:https > 10.210.31.23:61469 PA / Raw
IP / TCP 10.210.31.23:61469 > 17.110.228.28:https A
IP / TCP 10.210.31.23:61471 > 17.110.227.99:https PA / Raw
Simbolo ARP tiene probabilidad 0.0679320679321
Simbolo IP tiene probabilidad 0.93006993007
Simbolo IPv6 tiene probabilidad 0.001998001998
La entropia de la fuente es 0.378751880122
